{"data": {"frags": 1, "internal": 15, "bonds_strong": 5, "bonds_weak": 0, "bonds_superweak": 0, "angles_strong": 6, "angles_weak": 0, "angles_superweak": 0, "dihedrals_strong": 4, "dihedrals_weak": 0, "dihedrals_superweak": 0, "energy_trajectory": [-78.5663910134, -78.5941422303, -78.5949829029, -78.5950614572, -78.595063778], "final_energy": -78.595063778, "pure_rfo": [false, true, true, true, true], "trust": [0.3, 0.6, 0.6, 0.6, 0.6], "num_neg_eigenvals": [0, 0, 0, 0, 0], "lowest_eigenval": [0.0075, 0.0075, 0.0075, 0.0075, 0.0075], "lambdas": [-0.0615, -0.000384, -3.21, -3.2, -6.36], "quad_step_rms": [], "quad_step_max": [], "predicted_energy_change": [-0.0287, -0.000192, -1.6, -1.6, -3.18], "total_step_rms": [0.0775, 0.0151, 0.00696, 0.00117, 0.000531], "total_step_max": [0.149, 0.0239, 0.0125, 0.00248, 0.00113], "cart_trans_converged": [true, true, true, true, true], "cart_trans_iterations": [5, 3, 3, 2, 2], "cart_trans_rms_dcart": [8.92e-08, 6.63e-07, 7.96e-08, 3.96e-07, 9.32e-08], "cart_trans_rms_dq": [1.58e-07, 1.28e-06, 1.64e-07, 8.19e-07, 1.87e-07], "converge_gradient_rms": [false, false, false, false, true], "converge_gradient_max": [false, false, false, false, true], "converge_step_rms": [null, false, false, true, true], "converge_step_max": [null, false, false, false, true], "converged": true, "hessian_update_rms": [0.00261, 0.0073, 0.00434, 0.00948], "hessian_update_max": [0.0104, 0.0203, 0.0152, 0.0661], "trust_update_rms": [0.968, 4.38, 4.89, 1.45]}, "text": "Internal coordinates:\n* Number of fragments: 1\n* Number of internal coordinates: 15\n* Number of strong bonds: 5\n* Number of strong angles: 6\n* Number of strong dihedrals: 4\nEnergy: -78.5663910134\nMinimization on sphere was performed:\n* Trust radius: 0.3\n* Number of negative eigenvalues: 0\n* Lowest eigenvalue: 0.0075\n* lambda: -0.0615\nQuadratic step: RMS: 0.0775, max: 0.149\n* Predicted energy change: -0.0287\nTotal step: RMS: 0.0775, max: 0.149\nPerfect transformation to cartesians in 5 iterations\n* RMS(dcart): 8.92e-08, RMS(dq): 1.58e-07\nConvergence criteria:\n* Gradient RMS: 0.049 > 0.00015 => no\n* Gradient maximum: 0.0821 > 0.00045 => no\n* Minimization on sphere: Minimization on sphere => no\nEnergy: -78.5941422303\nHessian update information:\n* Change: RMS: 0.00261, max: 0.0104\nTrust update: Fletcher's parameter: 0.968\nLinear interpolation:\n* Energies: -78.594142, -78.566391\n* Derivatives: 0.00697, 0.0518\n* Quartic interpolation was performed: t = -0.207\n* Interpolated energy: -78.594852\nPure RFO step was performed:\n* Trust radius: 0.6\n* Number of negative eigenvalues: 0\n* Lowest eigenvalue: 0.0075\n* lambda: -0.000384\nQuadratic step: RMS: 0.00878, max: 0.0155\n* Predicted energy change: -0.000192\nTotal step: RMS: 0.0151, max: 0.0239\nPerfect transformation to cartesians in 3 iterations\n* RMS(dcart): 6.63e-07, RMS(dq): 1.28e-06\nConvergence criteria:\n* Gradient RMS: 0.009 > 0.00015 => no\n* Gradient maximum: 0.0212 > 0.00045 => no\n* Step RMS: 0.0151 > 0.0012 => no\n* Step maximum: 0.0239 > 0.0018 => no\nEnergy: -78.5949829029\nHessian update information:\n* Change: RMS: 0.0073, max: 0.0203\nTrust update: Fletcher's parameter: 4.38\nLinear interpolation:\n* Energies: -78.594983, -78.594142\n* Derivatives: 0.000342, 0.00135\n* Quartic interpolation was performed: t = -0.355\n* Interpolated energy: -78.595043\nPure RFO step was performed:\n* Trust radius: 0.6\n* Number of negative eigenvalues: 0\n* Lowest eigenvalue: 0.0075\n* lambda: -3.21e-05\nQuadratic step: RMS: 0.00295, max: 0.00608\n* Predicted energy change: -1.6e-05\nTotal step: RMS: 0.00696, max: 0.0125\nPerfect transformation to cartesians in 3 iterations\n* RMS(dcart): 7.96e-08, RMS(dq): 1.64e-07\nConvergence criteria:\n* Gradient RMS: 0.00204 > 0.00015 => no\n* Gradient maximum: 0.00451 > 0.00045 => no\n* Step RMS: 0.00696 > 0.0012 => no\n* Step maximum: 0.0125 > 0.0018 => no\nEnergy: -78.5950614572\nHessian update information:\n* Change: RMS: 0.00434, max: 0.0152\nTrust update: Fletcher's parameter: 4.89\nLinear interpolation:\n* Energies: -78.595061, -78.594983\n* Derivatives: 9.08e-06, 0.000148\n* Quartic interpolation was performed: t = -0.0658\n* Interpolated energy: -78.595062\nPure RFO step was performed:\n* Trust radius: 0.6\n* Number of negative eigenvalues: 0\n* Lowest eigenvalue: 0.0075\n* lambda: -3.2e-06\nQuadratic step: RMS: 0.000864, max: 0.00166\n* Predicted energy change: -1.6e-06\nTotal step: RMS: 0.00117, max: 0.00248\nPerfect transformation to cartesians in 2 iterations\n* RMS(dcart): 3.96e-07, RMS(dq): 8.19e-07\nConvergence criteria:\n* Gradient RMS: 0.000369 > 0.00015 => no\n* Gradient maximum: 0.00101 > 0.00045 => no\n* Step RMS: 0.00117 < 0.0012 => OK\n* Step maximum: 0.00248 > 0.0018 => no\nEnergy: -78.595063778\nHessian update information:\n* Change: RMS: 0.00948, max: 0.0661\nTrust update: Fletcher's parameter: 1.45\nLinear interpolation:\n* Energies: -78.595064, -78.595061\n* Derivatives: 8.46e-07, 3.79e-06\n* No fit succeeded, staying in new point\nPure RFO step was performed:\n* Trust radius: 0.6\n* Number of negative eigenvalues: 0\n* Lowest eigenvalue: 0.0075\n* lambda: -6.36e-07\nQuadratic step: RMS: 0.000531, max: 0.00113\n* Predicted energy change: -3.18e-07\nTotal step: RMS: 0.000531, max: 0.00113\nPerfect transformation to cartesians in 2 iterations\n* RMS(dcart): 9.32e-08, RMS(dq): 1.87e-07\nConvergence criteria:\n* Gradient RMS: 8.77e-05 < 0.00015 => OK\n* Gradient maximum: 0.000182 < 0.00045 => OK\n* Step RMS: 0.000531 < 0.0012 => OK\n* Step maximum: 0.00113 < 0.0018 => OK\n* All criteria matched\n", "filename": "berny.log"}